<?xml version="1.0" encoding="UTF-8" ?>
<xs:schema xmlns:xs="http://www.w3.org/2001/XMLSchema">
    <xs:complexType name="AddressType">
        <xs:sequence>
            <xs:element name="streetLine" type="xs:string"/>
            <xs:element name="city" type="xs:string"/>
            <xs:element name="state" type="xs:string"/>
            <xs:element name="country" type="xs:string"/>
            <xs:element name="zipCode" type="xs:int"/>
        </xs:sequence>
        <xs:attribute name="id" type="xs:long" use="required"/>
    </xs:complexType>

    <xs:complexType name="AddressesType">
        <xs:sequence>
            <xs:element name="address" type="AddressType" minOccurs="0" maxOccurs="unbounded"/>
        </xs:sequence>
    </xs:complexType>

    <xs:element name="addresses" type="AddressesType"/>
</xs:schema>