<?xml version="1.0" encoding="UTF-8"?>

<addresses xmlns:xsi="http://www.w3.org/2001/XMLSchema-instance"
          xsi:noNamespaceSchemaLocation="addresses.xsd">
    <address id="1">
        <streetLine>40th street</streetLine>
        <city>St. Paul</city>
        <state>Minnesota</state>
        <country>USA</country>
        <zipCode>3456</zipCode>
    </address>
    <address id="2">
        <streetLine>60th street</streetLine>
        <city>Minneapolis</city>
        <state>Minnesota</state>
        <country>USA</country>
        <zipCode>321</zipCode>
    </address>
    <address id="3">
        <streetLine>80th street</streetLine>
        <city>St. Paul</city>
        <state>Minnesota</state>
        <country>USA</country>
        <zipCode>3456</zipCode>
    </address>
</addresses>